{
  "n_cp": 4,
  "n_sp": 20,
  "params": [
    [
      -0.8155,
      -0.2521,
      -0.8544
    ],
    [
      0.3822,
      0.7315,
      -0.3812
    ],
    [
      1.0,
      -0.1425,
      0.1255
    ],
    [
      -0.2488,
      -0.3155,
      -0.4822
    ]
  ],
  "name": "refined_camber_exploitation"
}